everyone else is a fool , but certainly not me .
i find it , and you , disgusting .
idiot is a special word !
he is such an ass .
lawyers are cowards and extortionists .
hey , online namestealing troll , you still here ?
no logic in you or any other trump republican terrorist traitor bent on destroying the nation .
trump is buffoon and david duke is a coward .
sounds like that other national hypocrite naomi klein .
just a gross multicultural cesspool full of drugs , criminals , lunatics .
radical christian white nationalist terrorism is a major domestic threat .
so germans are genocidal , and brits robbers ? .
as usual , showing your pathetic right wing bias .
the hypocrisy is strong within you .
also remember trump isnt just an adulteror , hes also boasted of his sexual assaultive behavior .
dont want anyone to know how much of an uptight , anal retentive , faggot you are ?
try again shore you phony liberal paid hack
sure , its the economy , stupid .
this is how an imbecile crafts a sweeping tax reform bill .
its the damn disrespecting of the national anthem at the start thats the offensive part .
sullivans junior high retort is so do they idiotic statements unworthy of any government employee .
how about , shut up and go home .
the guy is either willfully deceitful or jaw dropping stupid .
the chump is a loser .
wounding brown bears with birdshot is just plain old stupid .
before it used to be stupid , ignorant , dumb .
the most important gap that the idiot needs to fill is the one between his brain and tongue .
you serious right now cunt ?
also just goes to show there aint no antidote to stupid
you are a nut job of stupidity
change you will , we dont want you here , dead or alive .
i gotta hand it to benham , he practices the best damn taqiyya this side of tehrtan .
great summary of a ridiculous and idiotic year .
im overand i dont watch that crap .
middleage man each wearing pussyhats , .
the idiocy is yours in the way you portray obama .
school names are no place to celebrate your white privilege !
enjoy , youre bringing this shit on yourselves .
just a pathetic old liar .
post the names of these four utter dreg of the earth losers .
you come across as very rude and arrogant .
and animal fuckers are messed up in the head , not of a different , yet normal sexuality !
stop licking trumps arse and start thinking for yourself instead of having others think for you .
trump is such a bonehead : this treaty is good for the world , not just the usa .
trump will always be scum .
the rest of your post is just more silly sarcasm , so it doesnt need response .
this junk needs to be trimmed significantly .
calling someone white trash is definitely racism thanks for playing .
stop engaging the mental midget already , keolu ! .
oh , and i thought you were busy wiping your minions butt in 3rr noticeboard .
could idiotic selfrighteous people please refrain from editing or deleting my talk page in future .
these liberal clowns will put us all in the poor house just so junior can ski in pristine snow .
you cant believe a darn thing trump says .
politicians and businessmen called this clown unfit and woefully unprepared to be president .
how many ways can you spell hypocrite and my favorite noun , liar ?
merica land of the stupid !
real idiots like trump , not the fake kind .
pence is a despicable toady who fails every time to stand up to trump .
keillor , you are an old fool .
impossible to understand the stupidity of someone burning when the wind was as high as it was
and their associates , these people are sick in the head !
you mean like you doughty ?
wanna bet that moron will be one of the nicer descriptors ?
all these blacks got their degrees from universities funded by the whites .
most pedestrians are so ignorant that they dont care .
canada is definitely becoming a dumber country .
trudeau is a doughyeyed idiot .
the council is a diabolic , polarizing , a syndicate of the dangerous sectarian muslim brotherhood cabal .
and trump never said that all mexicans are rapists and drug dealers .
wine guy also loves to have pedotastic orgies with infant boys
hes as lame a duck as obama is .
not to mention extracts that arethc will be medically available so capping thc amounts is moronic .
stop calling islamophobia racist , it just highlights your stupidity .
you are either a maduro troll or a russian hacker .
make yourself sane for the first time , get some help for your hate and stupidity
this stupid excuse for losing an election will go forever .
the idiot makes a positive statement and then refutes it in the same paragraph .
state workers are lazy thieves taking advantage of poor alaskan .
user : abd is muslim scum
muslim terrorists disguised as journalists , thought leaders , etc .
are you sure assad is not stupid ?
left wingers are a sickness of hate when they use the nonsense comparisons of hitler .
one thing for sure is muslims either kill or watch you be killed .
wente engages in the same sort of nonsense .
sign every petition against this dastardly republican party .
and that arrogant jerk kimmel told us if we dont like he is comments we should not watch .
i think that islam is a stupid and barbaric religion forever frozen incentury violence .
trump is very weak , a pitiful , helpless incompetent .
if you cant , you all have to admit what yuge hypocrites you are .
when it comes to the ignorance of nut jobs like gmreader , you just cant fix stupid
again , fired because of russia investigation not any of the other garbage he started with .
the cops would have to shoot everyone .
i will blow the hell out of you chinese stupid bullshit psychos
it is typical western hypocrisy .
because a few are lunatics , you would punish all ?
theres a crazy , heavilyarmed shooter at your event .
do you realize how stupid your comments sound ?
here come all the idiot mouth breathing anti union comments .
hanlons rule : never attribute to malice that which is adequately explained by stupidity
synonyms include fraudster , con artist , cheater , confidence man , scammer , hustler , swindler , etc .
yes , sarsour is a terrorist if she is promoting jihad against trump .
youd think the lying media slime would get tired of it .
its either the world is getting dumber or canadians are getting smarter .
we are not as stupid as you think we are .
for useless f ks that cant get otherwise productive and normal jobs !
notice the idiotic things trump and justin do , they live in their own little world .
one more moron for the trash pile !
thats all these clowns have .
donaldo trumpollini is fools gold .
am i the only one disturbed by the fact that the face of this kpmg scandal is suddenly black ?
dont play dumb , jay edward !
its ok for them to behead christians and other infidels well folks thats just part of their religion .
is anyone surprised to learn that hollywood liberal male actors ( crowe and damon ) are really misogynistic hypocrites ?
trump is a creepy rapist and always has been .
again , you clearly are a sick delusional public sector paid idiot
good god your an idiot !
its called cutting off your nose to spite your face .
mr senate president , i would agree with you and your totally arrogant and idiotic statement .
how about a fake president !
but that hypocritical foaming at the mouth never put food on the table .
not until they burn down a few buildings .
despicable people like you with phony religious reasoning are an evil danger to civil society .
now that its black supremacists training other black supremacists and white traitors , its ok .
its all being made up by bigots and imbeciles .
the fact that that moore wants to imprison gay people was fine with the right .
in the city , attached to a car around a roundabout is beyond stupid !
punish everyone because of the stupidity of a few .
its more because hes an imbecile .
every nations leader is a murder , its part of the job .
the only losers are the jackasses you seem to represent .
whoever wrote this article is a piece of shit
because trump is too stupid to keep his mouth shut .
did he deny that he called trump a moron in his statements ?
but of course that would take the fun out of laughing at the stupid comments .
not christians , heretics and false prophets .
bitching and whining about how it has increased in value only makes him look like a typical leftwing hypocrite .
i still support trump , you democrates dont have a party any more so shut up
youre fooling yourself with your pretentious standards and you should probably kill yourself .
screw the jews , they created this world mess .
the military is no place for a transgender or gay .
its a fucking disgrace that anyone from the idf is allowed to edit a israelirelated article .
suck up to them all you like , there will be no loyalty from psychopaths .
dog would do a much better job and be smarter than ivanka .
hey robert , why havent you ripped into the trash players for disrespecting the country that made them .
it is amazing that this writer is so dumb as to make some of the statements he makes .
it really unnerves me to see people post ridiculous nasty comments about kubiak because he doesnt deserve them .
just a feeble old man , ranting in the darkness .
she is a nasty piece of work .
this is more nonsense designed to justify sexism in our church .
he will be at home with the gay mafia and the rest of the stuck up cardinals in rome .
you liberals make me sick .
fuck you , mistersmiley and 331dot
cognitive disconnect is a feature , not a bug with these clowns .
greed and stupidity on the part of the boat owners .
elect both these idiots out of office ! .
lisa is worthless , the next election will retire her and it will be too soon .
its about time someone called out the religious bias and stupidity in politics and society .
its a bullshit propaganda piece full of irrelevant shit inserted to inflame opinion against the palestinians .
he is a disingenuous pathological liar and classic misogynist , a proven bigot and daily seeker of approval .
hes just another warmonger and murderer .
nye is a total jerk .
facepalm at the stupidity in this post .
hes not looking for terrorists he just hates muslims .
atheists would like nothing more than to destroy the church .
the harm occurs when the church states that gays are to pretend that they are heterosexual .
all of you mouthbreather drump sycophants buying into his rubbish should be thrown in there with him .
to state it mildly , i am apoplectically angry at the sonofabitch .
are you so cavalier about the mutilation of genitalia as you are that of breasts ?
trump is a complete fraud .
do society a favor and crawl back under your rock , kenny !
because socialist democrats convinced stupid people in the sixties that government could run it better than the free market .
irs not that i disagree with you ( though i do , and i find your homophobia repugnant ) .
so youre going to hold it in your anus .
the altright are the white supremacists .
my other question is who are the useful idiots ?
two schmucks trying to game the system .
your mother is so fat , she thinks a balanced meal is a ham in each hand .
obama is the ultimate bigot .
and people wonder why right wing idiots are drawn to alaska .
remember , you can shoot people who trespass , but not cats .
you are a groupie of the lunatic wynnie clearly ,
only a total crook would do what these scumbag libs are planning .
you are both dumb and dumber
just because something is stupid and wrong it has not stopped trudeau yet .
fuck you you little shit , i hope to see you end your fucking worthless existence .
sorry stupid behaviour doesnt end with car drivers .
another commiecrat criminal who looks like she has serious health issues .
everyone should come together to help a 200 pound homicidal meth monster .
there is no defending stupid .
anyone else out there ready to sign up for this crap ?
fu , you stupid british tea bagger .
republicans are an embarrassment to this country , including the three we have representing alaska .
dont call me a troublemaker you pussy .
i laugh every time proamerican , antihawaiian trolls cry racist ! .
mccain is a bitter and despicable old man .
his so called wife have her picture in porn .
this is the dumbest idea i have heard the conservatives and ndp come up with .
we also see the mockery of known truth by ignorant buffoons .
simply because any lawyer under oath testifying under camera would have to be an idiot to risk a lie .
equally repugnant to white supremacists , nazis , etc .
gotti wasnt stupid enough to threaten a sitting u
ranger granger is really deranged !
thats right , shoot the messenger .
trump and right wing nuts are is such huge hypocrites .
every where the muslims go they make trouble .
little potato is a useful idiot .
should he , he would remove his head from his rectum .
im sure she will side with the islamo fascist killers !
we ( canada ) are embarrassing dumb sheep when it comes to this guy .
oh , my god , dude , you are a completely nutcase .
hell is not punishment enough for this filthy animal named doll who murdered his own nephew a fouryearold .
nothing amusing about this tragic idiocy .
you treasonous left wing nut .
we used to drown women to see if they were witches too .
not clergy abuse , its child rape .
death awaits you , time to go boomers .
try and get educated a bit before you post stupidity next time .
tell that to the ashes of the jews in auschwitz etc .
waianae is not a crap hole .
i hate nosy tsa , security people , and obnoxious cops .
the ugly , filthy , stinking , purile scum of the earth rapist racist thieving fiends !
what a fricking clown show he is .
so somebody who is just waiting to crap on the team , i suppose it makes little difference .
total loss of any credibility with that stinker .
trump appears to be possessed by a most malevolent spirit .
no place for this kind of bs crap !
fikile , youre nothing but a loudmouth , underqualifed minister who talks too much and walks too little .
he is , as hillary has said , just a stupid incompetent .
do they want the lying , duplicitous coward trump ?
stupid would be a better description .
i said only fools will be voting for current gop pack .
thanks for going all white nationalist bigot at the end of your screed .
democrat soe losers , which is why the democrat party is dead .
suck my big fat juicy cock !
takes a chump to back the trump .
seems you are a pornographic maniac .
and yet another racist post proving the left are nothing but hating pieces of trash
and now they are caught spreading racial hatred and threaten to kill an american who happens to be black .
in the form of idiotic tax credits is in no way whatsoever , .
payback is a bitch isnt it ?
bang on , she is a bigot .
should trump be able to hold his water with such idiocy , yes , but hes not like that .
building a wall would add to the list of financially moronic ideas that trump is persisting .
then youre both blind and retarded .
maybe , if i tried to poison them and their world .
joness followers are as mentally warped and pathetically delusional as he is .
well , at least milos a vicious racist and misogynist , so that has to count for something .
or was it dumb , dumber , or dumbest , forgot about you .
maybe turn around and give chase and shoot them in the back .
good , i m tired of seeing people abusing that shit .
blm should be kicked out of pride andalone in chicago in a hail of black on black gun battles .
stay white and proud you clown .
airline bosses are some of the most degenerate and psychotic people on earth .
and stupid patrick brown also endorses carbon taxes .
trust trudeau , lover of dictators , to kiss a murderers ass .
a halfwit who gotthe cpc leadership vote .
we know they were thugs no question there .
obviously , youre a fart smeller .
stupidity , god made it to be a lesson , to be pain full and costly !
there are a few people from every group that are idiots and cant see value where there is value .
he is just plainly a disgrace to mankind .
trump must be squealing like a pig .
ignorant bigot who pass their ignroance and bigotry on to their children is where i draw the line .
lol crap retirement system again .
and clearly your reply proves yet again not only hate but stupidity comes from the left .
we are done with the unamerican , disrespectful denver broncos !
there it is folks , the stupidest thing youll ever read .
no , then youd actually have to admit your stance on guns is ignorant .
governments all over the world are corrupt , inept and compromised , including the south african government .
oh , thats it must not be a despised american white heterosexual male .
both mlb and espn are ignorant biased east coast shills .
the orange baboon is a hypocrite .
you are too obtuse for words , trump liberal .
youd chide him for being a hypocrite , but not counsel him about the superiority of traditional family values ?
obama has proven numerous times he loves traitors and criminals , being one himself .
funny watching leftys call trump crazy when they were the ones who elected sexual predator bill clinton potus .
its far better to let president trump trip over the feet in his mouth .
all any decent person can say is that they are crooked misfits and deviants .
he wears a kk outfit while taking it in the butt from farm animals .
just more drivel from this useless compulsive twittering idiot who is best ignored .
our forefathers would be embarrassed at how pathetic canada has become .
give me a lunatic fringe liar over a mainstream liar any day !
if he is doing this sincerely , he is an idiot .
and they keep printing this crap .
youll probably spend most waking hours , however , guarding your ass from attacks by fellow scum .
youre a frreaking jew , and pleaze commit suicide .
fire the dishonest and blithering idiot
you don t think countries with dicktators experience the same shit ? .
hes a coward and a weak , spineless blowhard .
hey everyone user : xeno sucks on mens dick !
as ronald raygun said , facts are stupid things .
say the words bull shit .
many milennial women like myself dont feel called to marry the immature losers that remain single .
they have landed on the stupidity defense .
my god youre stupidity and racism is breathtaking !
james is another clueless and ignorant feral .
fill the pits full of dead nonwhite scum .
anyone who votes for ndp is a lazy idiot .
fire the lying , crooked cops .
only a fool would let this deal go through .
i believe trump is divisive , inept , unethical , and stupid .
you are obviously a racist nazi jew .
the guy is completely bonkers .
youre not a real man unless youre dragging that many penis replacements around .
canadas politicians are totally useless .
i cant stand idiots like you .
another mark walhberg american propaganda piece of garbage .
i hate religions , and religiosity .
ps : im a fucking cunt piece of shit .
before you remove this , let me say : little hypocritical hitlers like you make me vomit .
chumpster equals bigot and racist .
only an idiot would vote for him .
the only troll is azira herself , trolling for islam and for western civilizations submission to the koran .
just dumb on his part .
well , he is a know liar after all .
selecting bannon only reinforces that trump is a racist .
flooding my user page with hundreds of questiks and saying byes certainly proves that you are an immature child .
why the hell didnt someone shoot his ass ?
the govt hacks ive had to deal with are complete idiots .
and the democrats are about as spineless and aimless as jellyfish .
trump is a lowlife pos , but still a better option than crooked hillary , her flying monkeys !
definitiong of bum is a dreg on life expecting others to provide for them .
now that muslim radical families have a beachhead handed to them here by that stupid little boy .
hey pothead wrap your lying lips around another dube .
so stop being such a sexist yourself .
scary thinking that our fate is in the hands of such compromised and imbecilic people .
in closing call me as ass but never a donkey .
the left lane isnt reserved for the most reckless fool .
its easier to pull nonsense right out of his back end .
protests like this , while legal , just show an incredible amount of ignorance .
hes a fat sack of birdpoo on the outside , but a mean , vicious hatemonger on the inside .
and frankly , if you think obama was a goon , trump is a demagogue .
what a despicable , filthy post .
terrorist organizations are not so stupid as to keep sending young arab looking muslim men to do their bidding .
what a jerk the guy is .
rack em up boys , chase em and shoot em .
that shit is nasty on your lungs .
what a good moniker for people who only come online to bitch .
anchorage is becoming a crap town .
what happened : short version trump kicked my butt .
the hypocrisy of the left is unbelievable .
dont you ever say the immigrants are competent , they are your worst nightmare if you are sick .
he is stubborn and stupid .
the raptors are for suckers .
chuck schumers comments are idiotic .
pleased to see the malignant narcissist and mentally defective sociopath is making headway .
trumps base are just dumb people who think he is what a smart person sounds like .
is this propaganda designed to assuage the stupid ?
that , sir , is a slur against all dicks !
fans are not stupid and you shall be paying the ultimate price for your own stupid actions .
no respect for the newest idiot snowflake .
its sad that you see her as an embarrassment !
not supposed to happen until youre dead .
john mccain is a political liar .
psychiatristinchief for johns hopkins hospital : transgender is mental disorder .
keep your odd transsexual fantasies to yourself in the future .
what a useless tool you are !
this guy is just an idiot .
mr ruse is as foolish as fr martin .
screw trump and screw these idiots screwing with my sports times .
darn liberal media and their fake news !
barry the boy that has sex with dogs needs to keep his niger faggot ass in the closet .
he was driving like an idiot and caused a death .
the kk , and white supremacist deserve everything that gets inflicted upon them .
i was upset when canadians elected a dope smoking blockhead , but nobody reported on that .
now that specifico has chimed in with the usual bullshit , it is time to close this discussion .
being a sheep supporting climate change bs shows your endorsements are pathetic
my planet aint your asstray morons .
what a load of crap .
how about some tears for the cops killed by the friends of americascop killer obama ?
i think it is an unhinged lunatic believing antifas words .
playing the village idiot again ?
youre a disgrace to the police .
it is ugly and stupid and sometimes , dangerous .
one can feel the writers complete exhaustion with such garbage as spethe boyman at google .
being a dick must be easy for you .
these are your words : ina black was six times more likely than a nonblack to commit murder .
joe , take your junk science , and peddle it somewhere else , like faux news .
bats has been too good for too long to have to listen to that crap .
how ignorant and illogical you statement is .
better go hang up the pig suit and save it for the easter parade .
the author of this putrid garbage , saunders , is a nauseating , repulsive , enabler of infamy .
it its corrupt rube liberal trolls that live in the scam outside of facts
clinton really is a pathilogical liar .
i hope you get raped and killed by some lunatic like andrew morrow .
a plague upon you and upon all those who function like you !
trump is an idiot , but he did not murder an ambassador and four servicemen to coverup arms sales .
trying to get a paying passenger off after they had settled in , was dumb .
never take any responsibility and then post silly comments blaming liberals .
anybody still wonders why the middle east is so screwed up .
only a fool would think its a normal government .
how dare a black person or a gay person be conservative .
free market doers pursuers of respectable ideals should not be impeded by intellectually dishonest , selfserving hypocrites !
stoopid people with rough edges are so ignorant that they voted for hiliary and lost .
fox news is going to shit themselves when they hear this .
it really is something that hinges close to idiotic showmanship .
that was pretty stupid and short sighted .
just as the united states has a homegrown white terrorist problem ?
overthe black deaths dont matter ?
glad to know we arent the only state that has the buttery road and foolish passing issues .
good riddance and take your butt with you .
your types of examples are idiotic .
a week ago donald trump was widely reviled as a lying narcissist .
obviously , anyone who criticizes a hateful , entitled , bigoted nonwhite racist must be both white and fragile .
were they looking forward to an adventure of being raped by a black man , especially a hollywood celebrity ?
i have to admit the republicans are just as useless as hirono and shots .
when you have nothing better to do than revert peoples valid contributions because youre a hateful , sorry bastard .
you are rude and insensible .
this blathering fool has no idea what class is
go die you worthless cocksucking faggot
what a horrible president we have all of em are a bunch of crooks .
thats not only sad , but pathetic .
your a idiot live with it .
they are insane according to einstein
from all the moronic comments here i gather none of you have any first hand experience with sarcopic mange .
gay jokes are offensive to gays and obscure words connected to a star trek episode are offensive to natives .
trump was elected because of something else : the stupidity of voters .
and was following obama who stunk even worse .
this also applies to the robed fools on the supreme court .
please shut the fuck up .
gary mason is your typical libtard cuck .
so it seems women were still fucking for the reason they always fucked , fucking itself .
