your thinking is the train wreck of stupidity lib troll , the opposition is better even if they do nothing
how can you pull such bullshit out of your arse
bill clinton has used his power to extract oral sex from starstruck 20ish interns in the oval office .
some at a very young age by this woman and her rapist pedophile husband .
they compound their shame when they elect crude louts like trump .
thats got to be one of the most stupid comments .
and ending with a gratuitous insult really dumb .
what do you think about tillerson calling his boss a effing moron ?
what a self centered idiot .
as ive said before youre an idiot .
only if they are emptyheaded , vile , evil libtards like hrc .
you mean like denis coderre dumb ?
or they could have been dealing with an agitated , aggressive , drunk chronically ill and mentally ill .
disgusting , immoral people , rightwing extremists , who should be driven out of office asap .
every time you flag the post like a coward you make my point .
only stupid people go there .
lying anti american muslim mouthpiece .
they simply are too stupid to do otherwise .
they will regard him as a childish buffoon that has to be handle carefully .
stupid is as stupid does , i guess .
no , you are no friend of mine , you ignorant , arrogant , hypocritical blowhard .
why dont you and all those gop crooksthugs ?
oh shut up you meaningless scared to death pssy of a human !
unblock well at least im not a gay fag like you and your mom
xman is either an idiot or a psychopath or maybe both .
unfortunately for us conservatives , we cant fix stupid when it comes to the libtard left .
none of that excuses stupid , criminal behavior .
youre the insignificant fuck mother fucker !
the fact that we are all going to paying for this gigantic liberal party jerkoff just makes me sick .
after all , everyone knows that blacks dont have a racist bone in their bodies , right ?
what bs , the trump bump started after the election idiot .
the us is a failure at all it does under the leadership of forest trump and his gang of rednecks
hello , you sexy little lovehole ! .
ill say whatever idiotic comment i want for my agenda , regardless of its stupidity kat35
clearly the french are a nation of misogynists .
they negotiate just like muslim terrorists , there way or no way .
you politicians all of you should be fired and then most of you should be hung !
you , terry koeckritz , are a colossal tit .
we face a tidal wave of aggressive and impatient and ignorant drivers .
what do you expect from an old loser from the icon of racism , the state of mississippi .
and nk would be erased from the map , along with their mad leader .
so you can take it to a hole in the ground with your ashes and bones lol !
supporting this crap , step up enmasse and put .
we arecountry of losers and abusers .
go peddle your white mans guilt elsewhere .
you should read them and thereafter not look so foolish .
why dont you give the same advice to all the blacks killing each other ?
f u c k trump like the pos he is .
an armed society is a sick , dangerous , often accidentally shot society me .
more attacks perpetrated by loser economic terrorists .
are you a troublemaker or just plain stupid or both ? .
we excuse someones stupidity for lifestyle choices , and blame society .
your a fat spotty cunt .
find people like you that comment with out knowing the conditions to be jerks
then the dildo is placed inside it until aleems dad comes and eja
dont listen to this troll .
as anyone with half a brain would do .
they are cowards and have no shame .
time for conservatives to stop voting for lying losers .
crush your enemies , see them driven before you , and to hear the lamentation of their women !
will corrupt twisters of rotten laws make flimsy excuses for their abuses ?
these are a part of the segment of muslims who are radical extreme muslim terrorists .
catholics of color were smarter .
youre right , trump is a vindictive deadbeat .
so , fox news makes you stupid and angry , and real news makes you smart but angry .
scared of minorities , gays , women , its pretty pathetic .
playing them like they are stupid by using a name change is a slap in their faces .
not just arrogant , vain , narcissistic and thinskinned but cowardly as well .
ordinary people are just herds of cows to milk for these scum .
albertans your arrogance is trumped only by your stupidity when it comes to understanding the spoken word .
did your chip figure out the meaning of the word congenital liar ?
the democrat party is plum full of hypocrites which apparently includes you and your pet sheep wavemaker .
but , unlike you , i wont say that your are a liar just intentionally ignorant and biased .
to not factor in rent is ridiculous .
some sickos on the left are already blaming trump .
poidoggy the only people today calling it fake news are the demslibsfake news gang of fools .
the only socialists killing people these days are bernie supporters .
since only idiots would take politcal cues from facebook , i can see why the democrat party is alarmed !
im keeping your poop in a jar , till the day you come back .
trump is a global embarrassment .
you threatened to kill people when you made this statement .
as long as it makes it easier to kill you are for it .
the hypocrisy of republicans is just amazing .
trump , or bundy ) deserve to be hunted down , prosecuted and incarcerated .
rd , you are a hypocrite .
youre twisted granger or whoever the heck you are .
hes just a deadbeat loser .
the election of van der bellen was a victory for stupidity and cultural suicide .
needed a kick to the nuts .
your racist bigotry is revealed once again .
the stupid dems cheered when a sp was appointed .
mr emanuel no doubt of mexican dissent is the mayor of the murderous hell hole called chicago .
my sentence was kind of like stabbing a shovel into a piece of bloated roadkill .
what is racist about assuming that muslims are terrorists ?
out of the slime comes the troll injecting antinative racism into every news item .
trump is a bad guy .
high profile idiots think they have everything under control .
absolutely the most fucking horrible film ever .
trump has been kickin ass forths , and you still havent figured out he is da man .
the malignant narcissist and mentally deranged sociopath opens his foul mouth and nothing comes out but excrement .
bunch of hypocrites and the sad people that support them .
get that son of a bh out of the wh .
be a lying crook and get rewarded ( insert mulroneys picture ) .
how does he explain muslims killing muslims ?
i would highly recommend this person get to the hospital stat and have their head removed from their buttocks .
i dont trust muslim converts as it seems they are allowed to lie for their faiths gain .
maybe as much as the brits ( disgusting ) and the yankees ( pathetic ) .
hopefully the accused isnt a white chick from the hillside .
news for morons by morons .
wow another islamic scammer suing canada for his crimes ! .
quit being such a brown nosing suck to all women , especially the muslims
must treat mcconnell like his doppelganger , harry reid , and throw this steaming diarrheapie in his face .
go out and collect them at night , and kill them yourself .
of course he is a liar , he is a sociopathic murderer .
trump is a pathological liar and as corrupt as they come .
both are unworthy , dishonest and worse .
people mistakenly think that this is because he is smart , but he is actually greedy , and sneaky .
hillarys walking dead are still going around chanting racist , sexist , misogynist , bigot .
of course , this report will only provide more ammunition for bishops to screen out gay seminarians : .
your comment is disgusting , but more than that , its unchristian .
alkies love their booze and ciggies love their stinking cigs , but ban pot .
i wanted to break a bottle and kill that dipshit .
ryan is as big a bum as the jerk in the white house .
more like an unelected blowhard who cant stay retired .
the stupid one , not me
you elected a mentally incompetent man with the intelligence level of a 5yearold child to run our country .
until he wasnt , which is the case for every idiot with a gun .
you can all kiss my rump .
the republican party is the enemy , nihilistic and antiamerican , and it must be extinguished .
should we ban all white male christians ?
thats just how stupid ( and desperate and unpatriotic ) they actually are .
whiny pu $$ ies all the time .
jessica brown : way to screw over the consumer once again you tax and spend fools .
this piece of crap needs to be kept away from animals and the public in general .
im a conservative trump is a fascist .
you are a big poo poo face and smell like a frog .
none of these candidates give one flying fck about the rest of us .
ignorant of the billions of people involved in helping you .
what a crappy fluff piece .
im a caucasian american and those cognitivelychallenged pointyheaded idiots do not in any way speak for me .
fuck you , you cumguzzling , cockeating , shitfucking asshole cuntrag scumbag .
communication security is only for the little people and losers .
hes running out of gullible fools to scam .
gangsters , potheads , illegal residents , kk , arrogant hypocrites from california , theyre all unwelcome .
you are not serious , you are a blind paid liberal hack of lies .
if you were my neighbour , you could expect a swift flying dropkick .
talk about sucking at the publics teat , huh ?
may i also add that youre a cock and you should find something better to do with your time .
i am sorry that you live next to a idiot .
yes of course chess and gay sex is the same thing .
you still missed like half the shit ive changed .
why dont you go eat your mothers pizza bagels , homo .
theyre from the same dung heap .
while your base of ol white guys die off whats plan b for
if you are happy supporting antisemites with hateful views toward women and peculiar rules around sex , .
there seems to be more brain dead idiots on the loose daily .
oh those nasty wealthy , what are we at nowtaxation on them ?
100,000 people paid money to watch this garbage .
perhaps a bit hasty to call him a moron , hmm ?
imo , hes actually a very pathetic excuse for a man .
be killed if they dont praise this crap .
and how horrible they are to virtuous , nonracist , confederatemonumentopposing white guys like you !
probably just a simple minded idiot would be my first guess though .
a grown man who sen collins has more principled balls than he does .
you are a poster child for why gay people flee the roman catholic church .
who ever thought going into iraq would bring about democracy was a oil crazed fool .
no one trust the media anymore , and if they do they are useful idiots .
a bigger bunch of idiots there never was
you arent smart enough to understand humor .
one of the most stupid comments i have ever seen .
just so you know who flagged your disgustingly racist post , it was me .
ok to the bitch that wants to question booster seats .
yes but john this old fart is so much smarter than you can ever be .
oh , you must be republican who feels people are too stupid to run their own lives .
no tires of any designation and quality can fix arrogant or plain stupid drivers .
these repubicans are like cannibalistic pirañas .
trump looks amateurish and as silly as he always does .
what a bunch of mealy mouthed weaklings .
there werestates that refused to sign onto medicaid expansion because they read the damned law .
demo rats have no shame .
most people are in general mean , cruel , and malicious .
we can facilitate this decline by exposing these people for the fraudulent christians they are .
hillary is free , his executive order is screwed , and his appointments have just a few problems .
wow , talk about an ignorant comment .
white guy shoots moose and he is a despicable trophy hunter .
tried to kill his father by shooting him .
an ignorant negative tool with an alcohol problem undoubtedly
trump is the puppet of a russian fascist despot with the goal of tarnishing and damaging the u
youre about as black as my irish family .
and youre as smart as a big mouthed , small brained , juvenile .
you mean white nationalists like yourself .
ppl posting why aint the trible doing this , doing that annoying fucks .
the free world doesnt need your stupidity .
dumb comment , but he quickly recognized his mistake and corrected it .
the white trash inbreed thing , wow .
c2 : by association , trump is a nazi .
if you arent frightened i think you are an idiot
have fun wasting your life watching these overpaid immigrants .
trump has always been a con man .
i did try and fuck her .
because your name is dick !
just not some people , like this rich jerk .
he appears to thrive on this stuff and often makes the media look like fools .
so says the next white psycho creep .
i fucking hope you get raped .
this garbage has a right to speak , no matter how vile his message .
you are most probably some snotnosed tyro trying your hand at what you know nothing about .
fortunately for hpd , criminals in hawaii are idiots .
you suck your family members cocks !
lauren , your thought process is pathetic .
what a bunch of hysterical nonsense .
no ones claiming the defendants dont have dumb tattoos .
why dont you talk about your benefits from white racism here ?
there is a reason europe is going to hell in a hand basket , good luck with that .
if you vote in a bunch of idiots , you get idiocy .
id like to meet this culture and punch it in the face .
hes a killer , though , mr .
not a personal attack , you sensitive moron .
it made me paranoid and stupid .
this clown is in way over his head and needs to go .
professors who sit in stinky old buildings dreaming up rubbish about productivity and growth .
what a pathetic political degenerate .
you gave up hope of racism ending so you voted for a racist .
you suck sand nigger pussy !
many are stupid , hence the shoe bomber and many others , a few who have blown themselves up
it would be stupid not to .
he had steel balls too !
yes , its silly in fact , racist to portray jesus as a white , rosycheeked , blonde swede .
and shut down the islamic terrorist sympathizers in the media .
this from a racist who lives under a rock and shares its iq .
now , what a bunch of nonsense this article is .
its time to kick these leftist fools off wikipedia .
killing tpp is no big deal it was going nowhere .
ah yes , thrills for stupids .
of course i feel better not being exposed to filth , tripe and nonsense .
germans kille you dirty slavic bastards and we will kill you dirty slavic bastards .
if you disagree then youre racist , youre sexist , youre a bigot , youre stupid .
i see the psycho cat hating muslim is still trying to make every story about amy .
so sad the voters in her district are stupid enough to continue to elect her .
wake up and smell the hypocrisy .
and i doubt the pathetic chinese navy could even beat the canadian navy .
he is the open , oozing , infected sore that our inherently sick country has to deal with .
what a pathetic and immature perspective you have !
fat and stupid is more accurate .
i think real stupid is posting drivel on here constantly when logic defeats your every word !
would he have ended these cash for access , buy a political whore events if he wasnt caught ? .
that governments solution is to just like this child die .
comparing drunk drivers or rapists to a woman seeking sanctuary is ludicrous .
a lot more whites then blacks are killed by police .
heard her cunt smells like alley behind a crab factory .
tired of paying for the low end garbage !
let him continue in this vein until he has enough rope to hang himself .
your an antiamerican moron if you cant see what is happening here .
butts butted in and spanked justins butt .
until he blows them to hell where there are no virgins .
how dare you , filthy nigger , presume to know about the regions history ?
what a bunch of retards !
and his parents are worse .
as most ( 70 ) of thinking people do not care what these narcissistic morons think .
the obama administration is incompetent and this is just another example of their stupidity .
this notion that the state knows better is groundless and ludicrous .
good , dont let the door hit you in the butt as you leave this conversation mr .
easy answer to the last question , of course hes dumb .
after seeing shit like this i expected you to be some throwaway sock puppet .
dont care if its muslims , nazis , white trash , blm or any other .
and yes , he was a dolt .
white trash expendable honky fromgreat britain to the colony is still with us .
ur just a fuckin scumbag who likes annoying people , get a life !
just the lying socialist way .
samantha bee : a bully , polemicist and a hater .
they are as homophobic as i am !
like that little racist hiding behind a made up name .
fuck off you stupid aspy asshole
i cant believe other ignorant fools voted for him .
trash more starbucks and mcdonalds , set dumpsters on fire , invent more categoriesginalized , oppressed sexual minorities .
its typical ndpee bribery , using debt to bribe the naive and stupid .
i am fed up past my eyeballs with complaining , violent , crackaddicted niggers .
when does this ogre get off his butt and deliver something worthwhile ?
ted , your remarks are offensive , ignorant !
these inmates would feast on a clueless twitter twit like you .
why are we even talking about this crap now ?
trump is a reckless , ignorant , dishonest man who lacks credibility in america or the world .
so the nastiest most irrational drivel is exempt from criticism as long as you call it an opinion piece ?
it was easier for me to tell myself it was rough sex , not rape .
take your lies to the toronto sun where critical thought goes to die .
go back to the huffpuff and media matters with your other america hating leftard trash .
what nonsense you spew , kk .
there is no difference betweena rightwing conservative hating on gays than a muslim hating on america .
good riddance to an oilytongued hypocrite , bully and adulterer .
yet you protest the use of a death penalty on a black guy that shot up a chucky cheeses .
hey stop fking your mothr ! .
i was just feeding him back his own , hypocritically selfrighteous words .
its time to throw the bum out .
lindhouts mother , herself a victim of her daughters stupidity , is only revealing some very questionable rcmp tactics .
ab : man , you are one sore loser !
being stupid is an offense ?
like willie martinez , youre an idiot .
otherwise knock off the racist crap !
i didnt vote for the liar
you need a pussy , your geek !
harper was great compared to this clown .
oh ok fuck you asshole die im going to kill you
the porky little dictator and trump have a lot in common overthetop rhetoric being number one .
he is a disgusting joke .
america is a stinky pile of shit .
you have spoken like a true drug addict , westernpatriot
hey , ipadperson , please try to keep fuck etc out of edit summaries .
obama has been a total failure , and now looks like a sore loser .
dude should have been taken to api , he would be right at home with all the other knuckleheads there
if you want to get raped , let the government get involved in the free market .
thats all the garbage you can come up with to bash trump ?
only an idiot , and apparently the globe , would take a nik nanos poll at face value .
which rightwing media trash did you find this stupidity ?
its like trying to be a food writer when youre a pothead .
this man is a waste of skin !
this is all so ridiculous .
and the dumbs will commence obstructing .
so , whose the fool now ?
your claim was so ridiculous , and false , i focused on what you claimed in the sentence .
he could be some drunk jerk with a gun .
i think you are as dumb as a box of hammers and much less useful .
harris and miller are just to dumb to like .
another useless thief exited from society .
idiots like you are dividing this country and thats what chump wants .
i agree with you the white lefties globalists are the most hypocritical humans of them all .
hilary clinton is a horrible person .
im gona hunt you down and kill everyone you ever loved
trump is an admitted white supremacist , you cant get more racist than to claim youre a white supremacist .
sadly , the gay community , and its lackeys , refuses to accept the evidence .
youre an idiot if you think ward beats flake .
human beings are basically fuking idiots !
this man is just white trash very rich white trash .
muslims remain free to kill and do fgm on females with atwoods blind eye .
and people wonder why so many black people are in jail .
good luck wid dat you quer fuking homo .
yes , the denver police are killing so many whites just for looking at them .
i know , im a horrible bigoted , murdering oppressor by right of birth .
everyone looks stupid , and loses .
im not gonna bother with agk and is a dick move .
stop stalking like the insane person you are and seek medical help .
trump and his idiots are painting themselves into a corner .
this is a fkc up !
you are parroting the nonsense and calling liberalism a mental illness .
fck i hate stupid people !
i bet youd cut off your nose to spite your face .
the arrogance and hypocrisyor moonbeam and his vision cronies at work once again .
besides we had enough of the entitlement garbage from his predecessor
thats far more than your reportedthis nonsense must stop , you sound like , and are , morons .
youve still lost your fucking mind .
synonyms : stupid silly idiotic witless brainless vacuous more .
government sucks the life out of an economy .
this latino will never get up until everyone of you racist wikkipedia gringos are behind bars !
all pollution tastes yummy on my damn cheerios !
you will know the false christians .
the ship of fools are sailing full speed ahead .
these exam retakes and try until you pass ideas mean any idiot can get credentials for any profession anytime .
honestly , the knuckleheads that are running this state .
not legal in canuckduh , look it up and then smack yourself on the forehead .
youre an obscene person and you should be banned .
time for these clowns to retire .
unkind , uncharitable , mean , small minded , lacking in comency .
time to pull this rubbish .
if i fat in the backyard will i kill my grandchildren .
your a dirty wanker who loves little boys naked
omg stab myself in the head eww !
if you dont agree with those on the left you must be a white supremacist .
so , revealing that jones is a relentless and malicious liar is leftist hate ?
perhaps a shootout can be arranged for his accomplices .
hey , hes the darling of the christians of the crotch .
hence , yes , vasquez is a pedophile .
care to take a poll by transgendered activists if they consider him to be mentally ill ?
that means you wanna lick her vagina ! .
why doesnt someone send a sniper after the little fat kid .
ridiculous hypotheticals are simply ridiculous .
this has got to be the stupidest , most corrupt , method of bidding in the history of mankind .
it makes them look stupid and makes me think they think im stupid .
so can we punch trump in the face ?
the lot of them are not worthy of respect and should be driven from the communityent people .
oh , one more thing , when it comes to prehistoric life , you guys are idiots !
u think this is some kind of stupid game ?
disrespecting the goat is disgusting .
can you see how ridiculous these cases are becoming ?
just how stupid are these people ?
yo ed , you are an infidel .
if you dont like her shut up and leave .
until feminists take on islam and how it treats women , the entire movement is a total farce !
do i know you for a blustering , bloviating fool ?
the trump supporters are too stupid to understand this .
but before you do anything let me just say the uncyclopedia fucking sucks .
i hope they beat each other silly .
apparently his plan is to drown them in money and then hug them to death .
trump is an idiot that is working hard to do putins orders and destroy america .
alaskans want someone as ignorant and brain dead as they are .
dumpy should keep his big mouth shut .
peterson is so grossly unqualified to hold a seat in congress its ridiculous .
but thats what myopic democratic halfwits do .
why are you racists so color blind ?
need emotional support because you are a fat pigbreed with a muslum give the neighborhood dogs a break .
my kids go with much less while he pompously grins and speaks rubbish telling me that i am racist .
jezz you people are really starting to look stupid now
you get what you voted for and mother nature has no mercy for fools !
you ignorant fool , i did not even say one swear word at klptyzm .
with sex from underage girls !
if you or anyone else were to be shot by a single shot .
that fatass chink from oz , phanatical , is ruining the reputation of your art .
back to your nation hole .
donald trump says taxes are for stupid people .
you know selfhating , cretins and morons just like you .
it will be the quiet dumber than a bag of hammers set and its paid media team
she was assassinated by a coward .
he refuses to acknowledge the terrorist disease : islamic radicalism .
if this ban were about security they would put those murderous lunatics at the top of the list .
tiptoetys anus is stretched by grawps massive cock
those idiots already made our great state look incompetent and this whole scenario made it even worse .
just too bad there isnt some way to weed out the idiots .
how can you people vote for these goons , whats wrong with you ?
because if they did , they wouldnt be responding in this utterly stupid manner .
republicans love to pretend they are stupid .
this idiotic piece of orange trash in the white house needs to stfu .
hate comes in all forms , you just choose to focus on muslims .
no , davis is an idiot like no other in history .
