even when the right things happen , they still find a reason to shit on it .
why ? just to be dicks ?
that would be such a mind fuck the criminals wouldn 't know what to do
we don 't give a fuck about your psn or xbox live
 bomb it all to shit 
swing the long dick of the law because they have short dicks ?
america got the shit colonized out of them and i don 't see them being poor .
fuck me , we 're falling behind everywhere .
you failed to aid the victim or do aynthing about it to , so fuck you .
i imagine it went something like \ do you want me to beat your dick off ?
well shit - by all means exterminate them then .
and , are terrible shit hole states to live in .
he had the house and senate in 57 and shoved shit down our throats we never wanted .
for iron dome and this bastard tells us shit ?
deadman snowman is a fucking idiot .
the jetwash of our f - 45 's would be enough to knock over their shit government .
that 's the sound of nobody giving a shit .
water canons can be fucked up .
what happened to the angsty little punk - asses ?
holy shit you really are dum - dum - dum - dum - dumb .
your a fucking retard you islam scum
this is fucking nuts , the disneyfication of new york is complete .
your argument is completely full of shit considering the only people who say this had healthcare already .
nothing but shit comes out of her mouth so it 's really quite a reasonable statement .
no , you 're just a fucking retard with a pathetically simple view of the world .
your so full of shit lol go fuck yourself
mr conservative check out these hq pics of jailbait ass .
you rape apologists are only a step below these boys on the piece of shit scale .
i don 't give a shit down vote me to hell but fuck what this country is turning to .
christ you people are retarded .
is this the appropriate time to lecture about sticking your dick in crazy ?
who gives a shit though , right .
i 'm gonna shit on his grave .
you have to be brain dead to enjoy that shit .
might as well take a shit in their shoes while they 're at it .
* * yeah , i 've got a problem here with two big pussies .
get that cowboy shit out of your head .
your conception of \ shit \ is profound .
nope just fuck the clint 'ons .
holy fucking shit , it 's ann coulter 's wet dream come true .
why the bloody fucking hell do you brits allow this shit in your country ?
this is meta as fuck .
always a face tattoo with this type of shit .
man , what a fucking piece of shit .
i travel abroad several times a year and motherfucker if that shit doesn 't happen .
edit but now july is one hot bitch !
no transparency , no accountability , no integrity , no ethics , not a single fuck given .
go to war with any country and get fucked real bad .
obama has fucked up with this trade .
that 's shitting the bed then complaining about the smell .
let 's riot - time to burn that bitch down !
if you worked with murderers and rapists everyday you too would give many fucks about pensions and immunity .
fuck you both for beating me to the punch .
christians love to shit on the pope .
yeah i imagine they just raped the shit out of each other
the problem i find is that most of my friends who smoke view vaping as \ for pussies \ .
fuck ya ! get 'em good and extra judiciously .
i almost shit my self out of pure happiness thinking their leader was dead .
even more - why the fuck would a female american want to jon isis ?
why can 't they keep their shit at home and in their church ?
they get their boner problem fixed and we don 't have to see those fucking commercials anymore
this is just icing on the shit cake .
perhaps you should start by fucking off .
or are you bitching just to be an asshole ?
people are retarded when it comes to where they live .
not giving a fuck is one thing .
do you really think they give a shit , what and were you hold your assets ?
he gives quite a few fucks .
youll be getting fucked like the rest of us
or heck , couldn 't it also be argued that it 's a fucking poptart ?
fuck these guys and their $30 socks .
coffee also makes you shit .
they 'll be shitting pancakes for years .
isn 't this also the distinction between calling someone a bitch and saying they are acting like a bitch ?
i was gonna say i wouldn 't fuck her with your dick and somebody else pushing ! !
we could make them suck our dicks .
i 'm sure someone could dox their asses .
keep killing yourselves , it 's fun to watch
your job is to lead , not be the nsa 's bitch .
i wish some of these supposed community leaders would get on there soapbox and decry these fucking acts .
r 's love shitting on people .
i believe the term you 're looking for is \ fuckin' - a \ .
fuck that just dump em off the boat like they did to those people
that would still fuck me up
and i 'm all out of ass .
very few people give any shits at all .
no we liberated the shit in them .
edit nevermind , he 's a fucking troll .
yeah they don 't give a fuck .
yeah fuck those tax exempt non profits that do great things for the world .
all of the fatasses talkign about revolutions would recede back to their traielrs and bitch .
that sick fuck is going to be out in 54 years .
 i was told there would be bitches 
my friends and i commonly use the expression \ like a breath of fresh ass \
egypt , on the other hand , can go full assad on gaza and nobody will give a fuck .
hahaha ! good , why you not give him to cia for ass stuffings ?
that \ contraption \ of his is easily ten times safer than the shit you smoke daily .
fuck you hp , never again .
oregon 's state motto \ blow it out your ass , montana ! \
ffs terrorists quit yo shit .
the god damn country has gone mad .
i would call obama a piece of fucking shit and hope the secret service shoots him for me .
that 's some next level shit right there
at least you agree that legally , she 's fucked .
do you like getting fucked up the ass by donkeys ?
oh wait - you 're just some dick on reddit .
they don 't give a shit about it other than how it can increase their bottom line .
you really have to wonder how many republicans actually believe the shit that rolls out of their mouths .
he 's already partially fucked , he 's been accused , that 's all it takes .
one giant piece of shit .
fuck em let them starve .
wtf ? she raped a kid , she didn 't get divorced wtf is this alternate weekend shit ?
well you are a fucking asshole .
every little thought you have they do not know makes them shit their pants .
they do it all the time , they get cops in the crowd and they start the shit
not so much for any real political reason but because \ fuck you , we 're texas \
let me stick my dick in this hornets nest and oh shit .
we 're a fucked up species .
westminster is going to bleed you dry of your oil and then leave you to fucking * rot .
several of my friends pissed themselves because they were so fucking terrified of her .
stop being immature as fuck .
pussy riot fires nadezhda tolokonnikova and maria alyokhina world
yes , star wars legos are the shit .
i got downvoted for saying the same shit .
an ass out of u and me
take a shit ! masturbate a bit ! go home again .
it 's sad but she was probably parked like shit .
cuba is fuckin it up .
they 're trying to make you shit your pants every time you hear their name .
they still fucked up though .
it 's worse than 'not even funny' considering aa got their asses kicked on 55 - 55 .
we 're going to get fucked soon , big time .
these people are fucked in the head .
ahhhh shut the fuck up piece of shit .
if fallacies were dicks , that section would be a bukkake gallery .
well no shit a well equipped military trying to root out a guerrilla group killed more .
r worldnews germany destroys brazil what the fuck ?
unrelated to this thread but fuck that movie so much .
man go somewhere and fuck yourself .
he 's fucking with exit polls , there 's a con in there somewhere .
and then each will talk about how the others are equally animal pieces of shit .
they can go fuck themselves , the self - righteous asswipes .
that man is a fuckin dumb ass .
knees too sharp , wouldn 't fuck
he was in the same graduate program as former secretary of state condaleeza rice , for fuck 's sake .
anyone else worried about donald sutherland and morgan freeman bombing the shit out of texas ?
they need to regulate the shit out of the vaginas .
i 'd rather be a cunt than a total dumbass .
that he would say that he fucked your mum
sounds like johnson is full of shit .
i wasn 't talking about this fucking second settle down .
the actual alpha testing name for hershey kisses was hershey shits .
 he 's already 87 , give him a fucking coors already ! 
! you gotta be shitting me .
that 's why certain parts are rapidly becoming shit holes leicester was lost years back
countries who use nukes to threaten others are giant pussies
you mean espn , which was bought by abc in 96 , is shit ?
what ? why fuck dennis rodman ?
mccain would have voted 'fuck ted cruz' if he could , but had to settle for 'yes' .
- holy shit this thread is retarded
i certainly couldn 't give two shits .
just like the word dick .
as an atheist , fuck you .
nah man we don 't shit in the holy river , just float our dead relatives downstream .
leave nato so putin can ass fuck them ?
then the orcs enslaved the nation and fucked it all up .
putin is full of shit and we all know it .
discrimination is still alive for sure but making up shit to jump on the sympathy wagon is just bullshit .
these fucking isis psychos need to be crushed under the treads of liberators .
we don 't , that some straight 80 s shit .
so this is bull shit .
i was having a nice sunday afternoon and then i read that shit ?
i swear , don 't ppl have real shit to worry about ?
cops that want to fuck with people don 't choose city council members .
this shit would happen regardless .
plot twist putin has cancer and he gives zero fucks and destroys the world just for fun .
fuck this era of terror in which we live in .
they should attempt to invade finland again , so this shit would finally end .
the older generation obviously doesn 't give a fuck if we all starve .
\ oh those bastards at facebook respecting the law and shit .
after all , look at all the marxist kenyan shit they eat right up .
the pope isn 't a fucking unicorn , he 's a guy in a robe and funny hat .
fuck chris dodd &amp the mpaa , google rules i searched for it , too .
the government making an ass of all to fill their pockets .
he 's just fucking with us at this point , right ?
congratulations , you dumped shit on top of french fries .
we need to go kick their asses .
fucking morons don 't know the difference between weather and climate .
com $50k ain 't shit for a professional at the top of their field .
a fetus is a person , have fun in hell retard
but see , he leaked info for pussy .
i found it ironic as fuck
we all know you ain 't gonna do shit .
then that constitution is shit .
i can literally see the pepper seeds in my shit .
don 't let the door hit you in the ass on the way out .
this guy is a fucking dumbshit
fuck you captain , it 's time to put your money where your mouth is .
thats some shit out of boondock saints
sure reddit , go ahead and sell your freedom to sit on your ass in front a screen .
i am really getting sick of your shit christanity .
at least we get a small ass picture of the damn without the guy , so there 's that .
i 'm sure his beady - eyed little fuck trophy , teddy , is a birther too .
\ sounds like a fucking shrug to me .
the embassy workers are going on strike because their salaries are shit .
how ? how the fuck would has go up a ton ?
did you use that diploma to wipe your ass with yet ?
hey fuck you ! and stop stalking me !
what the fuck kind of world is this guy living in .
all the shit this guy has revealed and we 're talking about dick pics .
there 's a bunch of five star reviews on yelp just lambasting this fuck .
nobody gives a shit what old men from over 68 years ago said about anything , thanks .
i think ukraine has already fucked its self good and proper .
in short , he 's a cunt , but of the not - good variety .
the un has done \ fuck all \ in all respects .
with the statement to use their device with ugly ass ui to bring up the hbo content .
congress is more corrupt than a pile of dog shit
oh look , this shit again .
you 're also a low life piece of spamming shit .
yeh an all them forreners eatin ah swans n shit
nah mate that shit 's going up too .
good thing they 're not in the g7 , dip shit .
why would you shit in your hand ?
well thanks for outing yourself as a fucking idiot .
this is 37 % accurate , fuck the downvoters
it would be really nice if they just had to wear signs like racist , asshole , bitch etc
you sound like a pretentious cunt , i 'm not replying to anything else you say
yeah fuck all those innocent kenyans who 'll starve to death without foreign aid .
so you can eat my ass .
but do i want all my dick pics automatically uploaded to apple cloud ?
let 's see if obama vetos this shit .
and why the fuck did they skip out on mentioning glitter herpes
get your head out of your fucking ass ! ! ! ! !
your cock gets near me , and i will melt it with a fucking laser .
and you are nothing more than a fucking moron .
i could make jokes but some one would bitch at me .
talking out of my ass if you can 't tell .
don 't shit on my cupcake and tell me it 's frosting .
fuck a iphone i 'm still chillin on the s5
saudi arabia is such a cute little middle ages shit hole .
but fuck those guys , right ?
you should go back further to see how the us fucked with their politics before the hostage crisis .
giant ass moats , been saving imperialistic nations' collective asses since the 54 's .
he 's better then the handful of retards that are running right now .
it doesn 't , but the police still end up looking like jack asses .
also , we got a 29 % off sale on some shit for coffee .
the only restraining order i would get this crazy bitch would be coffin shaped
what a whiny little bitch .
\ fucking hilarious , goy , my shekkels are in orbit .
as a scotsman , you can go fuck yourself .
if we vote out of the eu we 're fucked .
they don 't give a shit if you smoke dope , import coke or fuck your niece .
respawn is for pussies , he 's playing on hardcore diificulty .
no , you shoot the cunt at the very first opportunity .
australia go fuck yourself , russia
i chuckle a little every time i hear a bbc announcer say \ pussy riot \ .
but fuck tony abbot for having the best interest for australians .
this cunt is no victim .
you 're basically being the inverse of what you think they are when you say shit like this .
i 'm guessing you 've never been fucked with by the cops .
fuck that they work about 59 months out of the year
but if saying \ fuck that group \ is much more offensive for you , go ahead .
if no one is able to do shit in this world , fuck them all then .
or is it just the joy of fucking their home nation over ?
ya fuck that 25 year old kid .
nah , wait until stefano shows up , shit is gonna get fucked up !
shoulda drew a dick on her and called in juice brenner .
that 's like wearing a shirt that says \ fuck ticket - issuing cops \ at a police rally .
israel must be in some deep shit damned if you do , damned if you don 't .
gove is a fucking idiot .
wasn 't soul crushing here because i didn 't understand shit .
you broke the cease - fires ! ! ! fucking cowards hiding behind innocent people .
while he himself is the one spending time to send takedown notices and bitch about it ?
and morons are who believe in all that bible shit .
there 's so much shit that would completely break down without a government .
fuck the victim , she 's suing target because somehow it 's their fault that she got stabbed .
as a fellow texan , agree 26 % and fuck them , i have way more then 26 bullets .
i am not going to be restricted from working because you fucking sacks of shit are lazy deadbeats .
and you don 't know shit about nothing .
random as fuck having nothing at all to do with what i or anyone said .
hard to avoid shit with assholes .
but gm fucks 46 million people and gets a bonus .
frank sinatra is my motherfucking shit , don 't diss him
though they did throw a lot of shit at him and some of it looked kinda big o
if you have a pimple you can kiss your ass goodbye .
a republican poses a budget that has a minimal deficit increase and it is a fuck up ?
you downvote things like \ go fuck yourself retard \ .
you mean like bombing the shit out of them , like we 've been doing for a year ?
yeaaauuhh no china might come and fuck things up
that 's more than a truckload of shit .
what if i wanna keep my wife 's pussy tight as a clam ?
absolutely fucking love the sheer amount of armchair dieticians and nutritional science experts nowadays .
look when isis faced down the iraqi military they where facing a bunch of fucking pussies .
amerricuh , fuck yeah ! commin' again to save the motherfucking day yeah !
fortress ! or maybe he flew off to wreck some shit in apokalips
so basically just talking out of his ass
naw man c 'mon ! the focus groups were all over this shit !
lol let me blacksplain something to yo ass not gettin' vaccinated is whack yo ! ferreal dog .
yeah brilliant idea who gives a fuck about innocent civilians ?
you just couldn 't skull - fuck these bastards fast enough .
he 's also the little shit who fucking loves the seahawks .
most religons are fucked up anyway
you guys in this comment section are fucking disgusting .
yeah fuck anyone over 77 ! we 'll never get old like those losers !
these retarded hipsters have no clue what selinux is .
ah man , i hope they get their dicks smashed .
i mean you can beat someone for being a peice of shit , not that it is right .
then do something that adds value to the wold like shoveling shit or stripping .
no one gives a shit about your prime minister but you guys .
did you just call me an ass ?
let 's just tip tap type away about completely useless shit , you fucking mundane lops
we do shit like that .
it 's fucked up when montana is the voice of reason
\ i * need * a fucking bagel .
note that all obama 's appointees voted for this piece of shit .
more like \ fucking shity pigs \
it 's about time someone calls israel out on their shit .
we had to send in the fucking active army .
shit was the funniest thing i 've seen in a long time .
yeah that epa and laws shit ?
cool - not all religious people are mean idiotic crazy twats
holy shit , they blew up a real artifact this time ?
nato isn 't gonna do shit if russia stops being nice .
how the fuck is mj still a schedule 44 drug ?
fuck iraq , and fuck iran .
get off your high horse you priveliged piece of shit .
it will definately be a * bitch *
fuck that , only if that which you object to isn 't heinously backwards and anti - civil rights .
most laws fuck over non - criminals
better bitch slapping the parents , til they see the reality
poor sam just nope 'd the fuck out .
you 're the perfect example of why this country is going to shit .
because ya know , fuck you don 't ask questions you terrorist .
thanks for sucking my dick honey
the moment people started posting shit comments like yours .
no one implies that you piece of shit .
well , we assume it was them or some other group of fundamentalist islamic fuck wads .
nah , fuck that ass clown .
sensationalist shit like this , reddit .
what can be expected from a bunch of fucking idiots ?
depends on if he has a child like ass
itt people don 't understand france being retarded .
that 's brutal ! kid wouldn 't fuck with no one ever again \
donald trump can eat a bag of dicks
fuck me , i * work * in one .
the fucking 1 % owns the government .
i have gay loved ones and i would fucking curb stomp you if said shit like that around them .
to be fair , peter hitchens is a twat .
ok so she 's fucked and thought she was pulling a fast one basically .
they 're too evil and guilty of actual crimes and fucking people over .
its like somebody buying a 81 x4 to compensate , nobody gives a shit until they hit somebody .
cheap electronics ! ah fuck it , i 'd rather have healthcare .
anyone who signs this shit is a traitor .
that 's condescending as fuck , don 't have a strategy there .
so he is the baby daddy while it was the side squeeze who was saying to burn shit .
you 'd think isis are already doing enough bad shit without having to just make things up .
you 're a fucking asshole , i hope you know that .
fuckin money where your mouth is my anus .
so because of a small minority we should give a shit ?
you only fuck once - female praying mantis
can 't watch any of the good shit .
this is the \ dumb \ shit they 're laughing at
iran ? they fucking hate this piece of shit
uber can go fuck itself .
all you downvoting sacks o' shit can go fuck yourselves .
that 's the warning i give right before i fuck my wife in the ass
isis can suck a dick .
 fuck you , lady ! 
once you pop out of the womb , they don 't give a shit .
holy shit , boehner does have a spine
no its bbc which will be fucked
i just give no fucks .
frankly i 'm not sure what the fuck point you 're even trying to make .
if that is 'fucking people' in your dictionary , then yes .
if corporations are people can we start handing out the death penalty for this shit .
but i 'd only be interested if you were sending actual shit .
oh go back to r guns you inbred piece of shit .
if you arent sexually active yet and male , go get the shit !
have you ever considered wiping your ass with sand paper ?
\ colon this is dick , and i believe you 've already met bush .
how is \ don 't fuck kids \ such a hard concept to grasp ?
my allah has a bigger dick than your allah ! ! - george carlin switched his quote intentionally
oh god how fucking horrible ! i mean , who cares .
i 'm getting fucked left and right here , both with and without having a stable income .
fucking pussies ! you 're not gonna do shit you cowards ! boooooooo
doesn 't that bite you in the ass later ?
so , perfect republican candidate , \ i got mine , fuck all y 'all \
remove the bitch and bring back fatpeoplehate .
because they are the party of fucking progress
not only is it not viable , it 's fucking dumb .
much of what nc has done in education is bat shit insane and awful .
and they wonder why the female rhinos won 't fuck him .
arrested for cutting milk , yet no us banker saw any real ramifications from the shit storm they cut .
pull some jack bauer shit and take out like 77 of those fuckers before you go out .
fuck you biden and obama .
org noam chomsky is a linguist , in other fields he 's full of shit .
i 'm russian , most people i know just dont give a fuck
if you dont do anything , everyone will call you a pussy .
no , silly , this is 91 - when bitches laugh about cutting up babies and selling the parts .
it 's a big fucking bold line that only republicans ignore .
think back to all the wars , they always took a beating they 're grumpy fucks for a reason
does israel think we are their bitch ?
well that 's good because fuck sharia law
fucking thugs break in to people 's houses .
this lady could write a book on \ how to fuck with people \
sounds like a load of shit to me .
fucking you people woah * * calm * * down sailor .
good to see that people don 't know shit but still claim to know shit .
shits gonna hit the fan .
i disliked the catholic school , they constantly talked about how public schools are shit and full of retards .
look at how alpha he is with his guns and shit .
i have to say , fuck italy .
too many little dicks itt .
no , \ climate change denier \ is just a polite euphemism for \ fucking moron
fuckin hell why can 't we just stop murdering brown people ?
except you 're talking straight out of your ass , so there 's that , too .
 fuck you 
what the fuck is up with these terrorists extremists lately ?
chances are these teens were still in fucking diapers when 91 91 occurred .
that 's insane that he 's now rich from being a terrorist american murdering piece of slug shit
you know , in canada , that is a giant \ fuck you \ .
let 's hope wopr is not involved or we are all fucked .
ever heard of minding your own business you guys are not the fucking world police .
fuck it , you made me smirk then mentally berate myself , have an upvote you devious bastard .
man , you guys should really learn what that word means before shitting trough the keyboard .
we shit on fast food employees , so they shit out their food to us .
it 's that some form of \ go fuck yourself \ command ?
this logic makes no fucking sense .
all you need to know is how to carry shit .
your ass isn 't a respected source .
yea , it ends with them saying \ fucking kangaroos' youtube
submission about isis \ fuck isis .
fucking french boy ! i 'll start you off with 40 k kkk .
what a load of patronising , prejudiced shit .
nobody fucks with the drake .
i just read this article and this is fucking disgusting .
lying sack of fat shit .
he has a small dick and a ton of money ! he compensates all the time , fuck it !
we can 't taint the good dick with the likes of a cheney .
fuck scott walker , i just hope his run exposes him
hey , call of duty no one gives a shit .
china is behind yelling calm the fuck down kimmy .
both sides ie the mass media is just fucked currently .
i think someone should hold that teacher down and beat the living fuck out of them .
the citrus one tasted like soda fucked a bag of rotten oranges , not lemon .
i love it when the \ skeptics \ of reddit eat up shit from iranian state - owned news .
if people are fed up with their govement , they should burn shit and make themeselves heard .
also , using the term intellectual flaccidity makes you sound like a fucking wanker .
proud to say that our state is much more financially healthy than our broke - ass neighbor , illinois .
texas - they don 't put up with any shit .
for all we know aliens get really fucked up on epsom salt .
i am not a fan of sea world but fuck peta .
what a piece of shit you are !
